goId,goName,countDE,countAll,pv_fdr
"GO:0060261","positive regulation of transcription initiation from RNA polymerase II promoter",1,31,0.436725318503539
"GO:0070229","negative regulation of lymphocyte apoptotic process",1,31,0.436725318503539
"GO:1902253","regulation of intrinsic apoptotic signaling pathway by p53 class mediator",1,31,0.436725318503539
"GO:0008585","female gonad development",2,100,0.445452589601212
"GO:0035282","segmentation",2,100,0.445452589601212
"GO:0045069","regulation of viral genome replication",2,100,0.445452589601212
"GO:0002082","regulation of oxidative phosphorylation",1,32,0.446741445115811
"GO:0009303","rRNA transcription",1,32,0.446741445115811
"GO:0050869","negative regulation of B cell activation",1,32,0.446741445115811
"GO:0051385","response to mineralocorticoid",1,32,0.446741445115811
"GO:0061157","mRNA destabilization",1,32,0.446741445115811
"GO:1903829","positive regulation of cellular protein localization",5,337,0.448450050327126
"GO:0019083","viral transcription",3,178,0.45438995472837
"GO:0045639","positive regulation of myeloid cell differentiation",2,102,0.455169965
"GO:0048709","oligodendrocyte differentiation",2,102,0.455169965
"GO:2000379","positive regulation of reactive oxygen species metabolic process",2,102,0.455169965
"GO:0000737","DNA catabolic process, endonucleolytic",1,33,0.455169965
"GO:0009648","photoperiodism",1,33,0.455169965
"GO:0010464","regulation of mesenchymal cell proliferation",1,33,0.455169965
"GO:0032232","negative regulation of actin filament bundle assembly",1,33,0.455169965
"GO:0033028","myeloid cell apoptotic process",1,33,0.455169965
"GO:0043928","exonucleolytic catabolism of deadenylated mRNA",1,33,0.455169965
"GO:0048384","retinoic acid receptor signaling pathway",1,33,0.455169965
"GO:0060045","positive regulation of cardiac muscle cell proliferation",1,33,0.455169965
"GO:2000758","positive regulation of peptidyl-lysine acetylation",1,33,0.455169965
"GO:1903362","regulation of cellular protein catabolic process",4,259,0.456908115942029
"GO:0051249","regulation of lymphocyte activation",7,508,0.457685054945055
"GO:0007265","Ras protein signal transduction",5,343,0.46199897029703
"GO:0045619","regulation of lymphocyte differentiation",3,181,0.46199897029703
"GO:0071466","cellular response to xenobiotic stimulus",3,181,0.46199897029703
"GO:0090316","positive regulation of intracellular protein transport",3,181,0.46199897029703
"GO:0062014","negative regulation of small molecule metabolic process",2,104,0.46199897029703
"GO:0009649","entrainment of circadian clock",1,34,0.46199897029703
"GO:0016242","negative regulation of macroautophagy",1,34,0.46199897029703
"GO:0030851","granulocyte differentiation",1,34,0.46199897029703
"GO:0031112","positive regulation of microtubule polymerization or depolymerization",1,34,0.46199897029703
"GO:0032212","positive regulation of telomere maintenance via telomerase",1,34,0.46199897029703
"GO:0043276","anoikis",1,34,0.46199897029703
"GO:0043516","regulation of DNA damage response, signal transduction by p53 class mediator",1,34,0.46199897029703
"GO:0045922","negative regulation of fatty acid metabolic process",1,34,0.46199897029703
"GO:0046685","response to arsenic-containing substance",1,34,0.46199897029703
"GO:0048536","spleen development",1,34,0.46199897029703
"GO:0070232","regulation of T cell apoptotic process",1,34,0.46199897029703
"GO:1902692","regulation of neuroblast proliferation",1,34,0.46199897029703
"GO:2000036","regulation of stem cell population maintenance",1,34,0.46199897029703
"GO:0008104","protein localization",33,2816,0.46560236516576
"GO:0045621","positive regulation of lymphocyte differentiation",2,105,0.465940855165596
"GO:0046545","development of primary female sexual characteristics",2,105,0.465940855165596
"GO:0071345","cellular response to cytokine stimulus",14,1120,0.467443033596838
"GO:0071902","positive regulation of protein serine/threonine kinase activity",5,346,0.468221002469136
"GO:0048638","regulation of developmental growth",5,347,0.469941740412979
"GO:2001237","negative regulation of extrinsic apoptotic signaling pathway",2,106,0.469941740412979
"GO:0000291","nuclear-transcribed mRNA catabolic process, exonucleolytic",1,35,0.469941740412979
"GO:0006739","NADP metabolic process",1,35,0.469941740412979
"GO:0039694","viral RNA genome replication",1,35,0.469941740412979
"GO:0048821","erythrocyte development",1,35,0.469941740412979
"GO:0050779","RNA destabilization",1,35,0.469941740412979
"GO:0070306","lens fiber cell differentiation",1,35,0.469941740412979
"GO:1901030","positive regulation of mitochondrial outer membrane permeabilization involved in apoptotic signaling pathway",1,35,0.469941740412979
"GO:0048524","positive regulation of viral process",2,107,0.474969773955774
"GO:0050821","protein stabilization",3,186,0.478630103143419
"GO:0002701","negative regulation of production of molecular mediator of immune response",1,36,0.478960141948115
"GO:0006007","glucose catabolic process",1,36,0.478960141948115
"GO:0016180","snRNA processing",1,36,0.478960141948115
"GO:0033572","transferrin transport",1,36,0.478960141948115
"GO:0035886","vascular smooth muscle cell differentiation",1,36,0.478960141948115
"GO:0045742","positive regulation of epidermal growth factor receptor signaling pathway",1,36,0.478960141948115
"GO:0035601","protein deacylation",2,108,0.478960141948115
"GO:0006091","generation of precursor metabolites and energy",7,521,0.481115799511002
"GO:0009636","response to toxic substance",7,521,0.481115799511002
"GO:0021761","limbic system development",2,109,0.483626782226563
"GO:0033138","positive regulation of peptidyl-serine phosphorylation",2,109,0.483626782226563
"GO:0043618","regulation of transcription from RNA polymerase II promoter in response to stress",2,109,0.483626782226563
"GO:0016567","protein ubiquitination",11,869,0.483822284040996
"GO:0030212","hyaluronan metabolic process",1,37,0.486121418853256
"GO:0030224","monocyte differentiation",1,37,0.486121418853256
"GO:0033120","positive regulation of RNA splicing",1,37,0.486121418853256
"GO:0045070","positive regulation of viral genome replication",1,37,0.486121418853256
"GO:0060260","regulation of transcription initiation from RNA polymerase II promoter",1,37,0.486121418853256
"GO:0070897","transcription preinitiation complex assembly",1,37,0.486121418853256
"GO:0098926","postsynaptic signal transduction",1,37,0.486121418853256
"GO:1903131","mononuclear cell differentiation",1,37,0.486121418853256
"GO:1904358","positive regulation of telomere maintenance via telomere lengthening",1,37,0.486121418853256
"GO:0003002","regionalization",5,355,0.488432326372025
"GO:1901698","response to nitrogen compound",14,1139,0.49214499272198
"GO:1903008","organelle disassembly",2,111,0.49214499272198
"GO:0043029","T cell homeostasis",1,38,0.495089680387409
"GO:0044003","modulation by symbiont of host process",1,38,0.495089680387409
"GO:1901186","positive regulation of ERBB signaling pathway",1,38,0.495089680387409
"GO:2000144","positive regulation of DNA-templated transcription, initiation",1,38,0.495089680387409
"GO:0098732","macromolecule deacylation",2,112,0.496709549854792
"GO:0070997","neuron death",5,359,0.498976889211418
"GO:0007219","Notch signaling pathway",3,193,0.50135998549323
"GO:0048640","negative regulation of developmental growth",2,113,0.501721865635573
"GO:0043604","amide biosynthetic process",11,881,0.502613657004831
"GO:0000183","rDNA heterochromatin assembly",1,39,0.502908757225434
"GO:0009069","serine family amino acid metabolic process",1,39,0.502908757225434
"GO:0014037","Schwann cell differentiation",1,39,0.502908757225434
"GO:0030866","cortical actin cytoskeleton organization",1,39,0.502908757225434
"GO:0031111","negative regulation of microtubule polymerization or depolymerization",1,39,0.502908757225434
"GO:0034661","ncRNA catabolic process",1,39,0.502908757225434
"GO:2000377","regulation of reactive oxygen species metabolic process",3,194,0.503474015406837
"GO:0006518","peptide metabolic process",11,883,0.50464031280077
"GO:0006354","DNA-templated transcription, elongation",2,114,0.504998874458874
"GO:0048856","anatomical structure development",68,6079,0.505752875
"GO:0019080","viral gene expression",3,195,0.506784531475252
"GO:0043620","regulation of DNA-templated transcription in response to stress",2,115,0.509953304514889
"GO:0042098","T cell proliferation",3,196,0.510054351364289
"GO:0043403","skeletal muscle tissue regeneration",1,40,0.510054351364289
"GO:0043902","positive regulation of multi-organism process",1,40,0.510054351364289
"GO:0090184","positive regulation of kidney development",1,40,0.510054351364289
"GO:1900117","regulation of execution phase of apoptosis",1,40,0.510054351364289
"GO:1902895","positive regulation of pri-miRNA transcription by RNA polymerase II",1,40,0.510054351364289
"GO:1904037","positive regulation of epithelial cell apoptotic process",1,40,0.510054351364289
"GO:0072593","reactive oxygen species metabolic process",4,280,0.511415043062201
"GO:0002460","adaptive immune response based on somatic recombination of immune receptors built from immunoglobulin superfamily domains",5,365,0.511739143950263
"GO:0009749","response to glucose",3,197,0.512616768642447
"GO:0030518","intracellular steroid hormone receptor signaling pathway",2,116,0.512665907354346
"GO:0046916","cellular transition metal ion homeostasis",2,116,0.512665907354346
"GO:0009896","positive regulation of catabolic process",6,452,0.514036658711217
"GO:0031032","actomyosin structure organization",3,198,0.515871598282443
"GO:0062012","regulation of small molecule metabolic process",6,453,0.516308965188364
"GO:0046688","response to copper ion",1,41,0.517487895238095
"GO:0051602","response to electrical stimulus",1,41,0.517487895238095
"GO:0071548","response to dexamethasone",1,41,0.517487895238095
"GO:1901699","cellular response to nitrogen compound",9,716,0.518097805806759
"GO:0030098","lymphocyte differentiation",5,368,0.518271979067555
"GO:0050673","epithelial cell proliferation",6,455,0.520359766999524
"GO:0001953","negative regulation of cell-matrix adhesion",1,42,0.52548965370019
"GO:0006308","DNA catabolic process",1,42,0.52548965370019
"GO:0006734","NADH metabolic process",1,42,0.52548965370019
"GO:0071364","cellular response to epidermal growth factor stimulus",1,42,0.52548965370019
"GO:0072595","maintenance of protein localization in organelle",1,42,0.52548965370019
"GO:0046660","female sex differentiation",2,119,0.525627369668247
"GO:1901700","response to oxygen-containing compound",20,1705,0.525627369668247
"GO:0009991","response to extracellular stimulus",7,545,0.526143874940786
"GO:0009746","response to hexose",3,202,0.528767627840909
"GO:2000736","regulation of stem cell differentiation",2,120,0.53027780880265
"GO:0008631","intrinsic apoptotic signaling pathway in response to oxidative stress",1,43,0.531507881355932
"GO:0021762","substantia nigra development",1,43,0.531507881355932
"GO:0034105","positive regulation of tissue remodeling",1,43,0.531507881355932
"GO:0045124","regulation of bone resorption",1,43,0.531507881355932
"GO:0055023","positive regulation of cardiac muscle tissue growth",1,43,0.531507881355932
"GO:0070266","necroptotic process",1,43,0.531507881355932
"GO:0071470","cellular response to osmotic stress",1,43,0.531507881355932
"GO:0090317","negative regulation of intracellular protein transport",1,43,0.531507881355932
"GO:1903146","regulation of autophagy of mitochondrion",1,43,0.531507881355932
"GO:2000648","positive regulation of stem cell proliferation",1,43,0.531507881355932
"GO:0048731","system development",56,5010,0.531507881355932
"GO:0046890","regulation of lipid biosynthetic process",3,205,0.538006519285042
"GO:0002761","regulation of myeloid leukocyte differentiation",2,122,0.538006519285042
"GO:0010463","mesenchymal cell proliferation",1,44,0.539472596244131
"GO:0051150","regulation of smooth muscle cell differentiation",1,44,0.539472596244131
"GO:0051154","negative regulation of striated muscle cell differentiation",1,44,0.539472596244131
"GO:1901985","positive regulation of protein acetylation",1,44,0.539472596244131
"GO:0034284","response to monosaccharide",3,207,0.544543963414634
"GO:0071456","cellular response to hypoxia",3,207,0.544543963414634
"GO:0051101","regulation of DNA binding",2,124,0.546966071094481
"GO:0000959","mitochondrial RNA metabolic process",1,45,0.546966071094481
"GO:0051204","protein insertion into mitochondrial membrane",1,45,0.546966071094481
"GO:0060612","adipose tissue development",1,45,0.546966071094481
"GO:0090311","regulation of protein deacetylation",1,45,0.546966071094481
"GO:1901028","regulation of mitochondrial outer membrane permeabilization involved in apoptotic signaling pathway",1,45,0.546966071094481
"GO:0048513","animal organ development",41,3652,0.552739939223936
"GO:0050679","positive regulation of epithelial cell proliferation",3,210,0.554861009345794
"GO:0044275","cellular carbohydrate catabolic process",1,46,0.555077276119403
"GO:0070849","response to epidermal growth factor",1,46,0.555077276119403
"GO:2000142","regulation of DNA-templated transcription, initiation",1,46,0.555077276119403
"GO:0014013","regulation of gliogenesis",2,126,0.555077276119403
"GO:0060341","regulation of cellular localization",12,1010,0.560575351981352
"GO:0006383","transcription by RNA polymerase III",1,47,0.562271887494189
"GO:0010799","regulation of peptidyl-threonine phosphorylation",1,47,0.562271887494189
"GO:0016073","snRNA metabolic process",1,47,0.562271887494189
"GO:0035722","interleukin-12-mediated signaling pathway",1,47,0.562271887494189
"GO:0060421","positive regulation of heart growth",1,47,0.562271887494189
"GO:1903580","positive regulation of ATP metabolic process",1,47,0.562271887494189
"GO:0002703","regulation of leukocyte mediated immunity",3,214,0.567810752438458
"GO:0043523","regulation of neuron apoptotic process",3,214,0.567810752438458
"GO:0030900","forebrain development",5,389,0.56852144773358
"GO:0045944","positive regulation of transcription by RNA polymerase II",14,1197,0.56852144773358
"GO:0007595","lactation",1,48,0.56852144773358
"GO:0008089","anterograde axonal transport",1,48,0.56852144773358
"GO:0032648","regulation of interferon-beta production",1,48,0.56852144773358
"GO:0032784","regulation of DNA-templated transcription, elongation",1,48,0.56852144773358
"GO:0032873","negative regulation of stress-activated MAPK cascade",1,48,0.56852144773358
"GO:0070303","negative regulation of stress-activated protein kinase signaling cascade",1,48,0.56852144773358
"GO:0097300","programmed necrotic cell death",1,48,0.56852144773358
"GO:0050792","regulation of viral process",3,216,0.573055282239559
"GO:0042063","gliogenesis",4,304,0.573055282239559
"GO:0045088","regulation of innate immune response",4,304,0.573055282239559
"GO:0006378","mRNA polyadenylation",1,49,0.573055282239559
"GO:0030850","prostate gland development",1,49,0.573055282239559
"GO:0035196","production of miRNAs involved in gene silencing by miRNA",1,49,0.573055282239559
"GO:0042149","cellular response to glucose starvation",1,49,0.573055282239559
"GO:0042398","cellular modified amino acid biosynthetic process",1,49,0.573055282239559
"GO:0048512","circadian behavior",1,49,0.573055282239559
"GO:0070231","T cell apoptotic process",1,49,0.573055282239559
"GO:0071349","cellular response to interleukin-12",1,49,0.573055282239559
"GO:0072348","sulfur compound transport",1,49,0.573055282239559
"GO:0090151","establishment of protein localization to mitochondrial membrane",1,49,0.573055282239559
"GO:0090199","regulation of release of cytochrome c from mitochondria",1,49,0.573055282239559
"GO:1904707","positive regulation of vascular smooth muscle cell proliferation",1,49,0.573055282239559
"GO:2000107","negative regulation of leukocyte apoptotic process",1,49,0.573055282239559
"GO:0036294","cellular response to decreased oxygen levels",3,217,0.573055282239559
"GO:0009952","anterior/posterior pattern specification",3,219,0.578683779096303
"GO:0007622","rhythmic behavior",1,50,0.578683779096303
"GO:0010718","positive regulation of epithelial to mesenchymal transition",1,50,0.578683779096303
"GO:0019674","NAD metabolic process",1,50,0.578683779096303
"GO:0021695","cerebellar cortex development",1,50,0.578683779096303
"GO:0032608","interferon-beta production",1,50,0.578683779096303
"GO:0043631","RNA polyadenylation",1,50,0.578683779096303
"GO:0045540","regulation of cholesterol biosynthetic process",1,50,0.578683779096303
"GO:0046850","regulation of bone remodeling",1,50,0.578683779096303
"GO:0061014","positive regulation of mRNA catabolic process",1,50,0.578683779096303
"GO:0070671","response to interleukin-12",1,50,0.578683779096303
"GO:0106118","regulation of sterol biosynthetic process",1,50,0.578683779096303
"GO:0045995","regulation of embryonic development",2,133,0.57931
"GO:0034097","response to cytokine",14,1209,0.579532453260374
"GO:0046683","response to organophosphorus",2,134,0.583643886104784
"GO:0071333","cellular response to glucose stimulus",2,134,0.583643886104784
"GO:0010656","negative regulation of muscle cell apoptotic process",1,51,0.584992227272727
"GO:0043628","ncRNA 3'-end processing",1,51,0.584992227272727
"GO:0045912","negative regulation of carbohydrate metabolic process",1,51,0.584992227272727
"GO:0050885","neuromuscular process controlling balance",1,51,0.584992227272727
"GO:0090102","cochlea development",1,51,0.584992227272727
"GO:0006119","oxidative phosphorylation",2,136,0.590885162895928
"GO:0006766","vitamin metabolic process",2,136,0.590885162895928
"GO:0050671","positive regulation of lymphocyte proliferation",2,136,0.590885162895928
"GO:0071331","cellular response to hexose stimulus",2,136,0.590885162895928
"GO:0000387","spliceosomal snRNP assembly",1,52,0.590885162895928
"GO:0009948","anterior/posterior axis specification",1,52,0.590885162895928
"GO:0010665","regulation of cardiac muscle cell apoptotic process",1,52,0.590885162895928
"GO:0030857","negative regulation of epithelial cell differentiation",1,52,0.590885162895928
"GO:0046580","negative regulation of Ras protein signal transduction",1,52,0.590885162895928
"GO:1902893","regulation of pri-miRNA transcription by RNA polymerase II",1,52,0.590885162895928
"GO:0032946","positive regulation of mononuclear cell proliferation",2,137,0.594334457504521
"GO:0071326","cellular response to monosaccharide stimulus",2,137,0.594334457504521
"GO:0045321","leukocyte activation",15,1314,0.596807650248531
"GO:0071396","cellular response to lipid",7,585,0.596897742226228
"GO:0018023","peptidyl-lysine trimethylation",1,53,0.596897742226228
"GO:0032210","regulation of telomere maintenance via telomerase",1,53,0.596897742226228
"GO:0045744","negative regulation of G protein-coupled receptor signaling pathway",1,53,0.596897742226228
"GO:0061614","pri-miRNA transcription by RNA polymerase II",1,53,0.596897742226228
"GO:0097366","response to bronchodilator",1,53,0.596897742226228
"GO:0055076","transition metal ion homeostasis",2,138,0.597191972972973
"GO:0002699","positive regulation of immune effector process",3,226,0.597280018009905
"GO:0043401","steroid hormone mediated signaling pathway",2,139,0.601635486048605
"GO:0010662","regulation of striated muscle cell apoptotic process",1,54,0.602509210408255
"GO:0014888","striated muscle adaptation",1,54,0.602509210408255
"GO:0031050","dsRNA processing",1,54,0.602509210408255
"GO:0042304","regulation of fatty acid biosynthetic process",1,54,0.602509210408255
"GO:0060043","regulation of cardiac muscle cell proliferation",1,54,0.602509210408255
"GO:0070918","production of small RNA involved in gene silencing by RNA",1,54,0.602509210408255
"GO:2000179","positive regulation of neural precursor cell proliferation",1,54,0.602509210408255
"GO:0010001","glial cell differentiation",3,228,0.602553497757848
"GO:0030879","mammary gland development",2,141,0.608246890080429
"GO:0002931","response to ischemia",1,55,0.608246890080429
"GO:0010659","cardiac muscle cell apoptotic process",1,55,0.608246890080429
"GO:0032781","positive regulation of ATPase activity",1,55,0.608246890080429
"GO:0042743","hydrogen peroxide metabolic process",1,55,0.608246890080429
"GO:0045620","negative regulation of lymphocyte differentiation",1,55,0.608246890080429
"GO:0072132","mesenchyme morphogenesis",1,55,0.608246890080429
"GO:0097345","mitochondrial outer membrane permeabilization",1,55,0.608246890080429
"GO:0043903","regulation of interspecies interactions between organisms",3,231,0.610983153434434
"GO:1901214","regulation of neuron death",4,321,0.610983153434434
"GO:0002218","activation of innate immune response",2,142,0.610983153434434
"GO:0048284","organelle fusion",2,142,0.610983153434434
"GO:0019320","hexose catabolic process",1,56,0.614404057906459
"GO:0055025","positive regulation of cardiac muscle tissue development",1,56,0.614404057906459
"GO:0090183","regulation of kidney development",1,56,0.614404057906459
"GO:0007264","small GTPase mediated signal transduction",6,505,0.616316117542297
"GO:0009743","response to carbohydrate",3,233,0.616950970182465
"GO:0009895","negative regulation of catabolic process",4,324,0.61871100088968
"GO:0072006","nephron development",2,144,0.618774824366385
"GO:0071453","cellular response to oxygen levels",3,234,0.619877661934339
"GO:0010574","regulation of vascular endothelial growth factor production",1,57,0.619877661934339
"GO:0010658","striated muscle cell apoptotic process",1,57,0.619877661934339
"GO:0051055","negative regulation of lipid biosynthetic process",1,57,0.619877661934339
"GO:0070936","protein K48-linked ubiquitination",1,57,0.619877661934339
"GO:0033135","regulation of peptidyl-serine phosphorylation",2,145,0.621652717198582
"GO:0071322","cellular response to carbohydrate stimulus",2,145,0.621652717198582
"GO:0002694","regulation of leukocyte activation",7,600,0.621850101905184
"GO:0051384","response to glucocorticoid",2,146,0.625793427686864
"GO:0017001","antibiotic catabolic process",1,58,0.625793427686864
"GO:0046622","positive regulation of organ growth",1,58,0.625793427686864
"GO:1903749","positive regulation of establishment of protein localization to mitochondrion",1,58,0.625793427686864
"GO:0048869","cellular developmental process",48,4408,0.628185658709107
"GO:0031667","response to nutrient levels",6,512,0.629390128148475
"GO:0043603","cellular amide metabolic process",13,1158,0.629583484982332
"GO:0120031","plasma membrane bounded cell projection assembly",7,605,0.631270883002207
"GO:0001658","branching involved in ureteric bud morphogenesis",1,59,0.631300220361393
"GO:0045454","cell redox homeostasis",1,59,0.631300220361393
"GO:0051058","negative regulation of small GTPase mediated signal transduction",1,59,0.631300220361393
"GO:1902808","positive regulation of cell cycle G1/S phase transition",1,59,0.631300220361393
"GO:0006508","proteolysis",20,1810,0.632795101321586
"GO:0070665","positive regulation of leukocyte proliferation",2,149,0.636129232119351
"GO:0044281","small molecule metabolic process",22,2000,0.636129232119351
"GO:0001836","release of cytochrome c from mitochondria",1,60,0.636129232119351
"GO:0018208","peptidyl-proline modification",1,60,0.636129232119351
"GO:0030865","cortical cytoskeleton organization",1,60,0.636129232119351
"GO:0032515","negative regulation of phosphoprotein phosphatase activity",1,60,0.636129232119351
"GO:0050994","regulation of lipid catabolic process",1,60,0.636129232119351
"GO:0098930","axonal transport",1,60,0.636129232119351
"GO:1902110","positive regulation of mitochondrial membrane permeability involved in apoptotic process",1,60,0.636129232119351
"GO:0035264","multicellular organism growth",2,150,0.638591653508772
"GO:0006027","glycosaminoglycan catabolic process",1,61,0.641677121609799
"GO:0010573","vascular endothelial growth factor production",1,61,0.641677121609799
"GO:0045071","negative regulation of viral genome replication",1,61,0.641677121609799
"GO:0070265","necrotic cell death",1,61,0.641677121609799
"GO:1904356","regulation of telomere maintenance via telomere lengthening",1,61,0.641677121609799
"GO:2001244","positive regulation of intrinsic apoptotic signaling pathway",1,61,0.641677121609799
"GO:0001678","cellular glucose homeostasis",2,152,0.645311725644386
"GO:0007030","Golgi organization",2,152,0.645311725644386
"GO:0007605","sensory perception of sound",2,152,0.645311725644386
"GO:0002260","lymphocyte homeostasis",1,62,0.645984475402699
"GO:0002437","inflammatory response to antigenic stimulus",1,62,0.645984475402699
"GO:0009206","purine ribonucleoside triphosphate biosynthetic process",1,62,0.645984475402699
"GO:0042267","natural killer cell mediated cytotoxicity",1,62,0.645984475402699
"GO:0048857","neural nucleus development",1,62,0.645984475402699
"GO:0055081","anion homeostasis",1,62,0.645984475402699
"GO:0061912","selective autophagy",1,62,0.645984475402699
"GO:1902686","mitochondrial outer membrane permeabilization involved in programmed cell death",1,62,0.645984475402699
"GO:0001837","epithelial to mesenchymal transition",2,153,0.647067029143106
"GO:0008203","cholesterol metabolic process",2,153,0.647067029143106
"GO:0000209","protein polyubiquitination",4,339,0.650934986956522
"GO:0048754","branching morphogenesis of an epithelial tube",2,154,0.651017718004338
"GO:0002066","columnar/cuboidal epithelial cell development",1,63,0.651017718004338
"GO:0009145","purine nucleoside triphosphate biosynthetic process",1,63,0.651017718004338
"GO:0031122","cytoplasmic microtubule organization",1,63,0.651017718004338
"GO:0070059","intrinsic apoptotic signaling pathway in response to endoplasmic reticulum stress",1,63,0.651017718004338
"GO:0030031","cell projection assembly",7,620,0.653876354573039
"GO:0050773","regulation of dendrite development",2,155,0.653876354573039
