goId,goName,countDE,countAll,pv_fdr
"GO:0022402","cell cycle process",116,1431,1e-24
"GO:1903047","mitotic cell cycle process",98,897,1e-24
"GO:0007049","cell cycle",124,1890,1e-24
"GO:0000278","mitotic cell cycle",100,1048,1e-24
"GO:0051276","chromosome organization",98,1249,1e-24
"GO:0006259","DNA metabolic process",88,943,1e-24
"GO:0006260","DNA replication",54,274,1e-24
"GO:0044770","cell cycle phase transition",70,640,1e-24
"GO:0044772","mitotic cell cycle phase transition",67,595,1e-24
"GO:0006974","cellular response to DNA damage stimulus",72,866,1e-24
"GO:0006281","DNA repair",59,563,1e-24
"GO:0006261","DNA-dependent DNA replication",38,152,1e-24
"GO:0000280","nuclear division",49,423,1e-24
"GO:0044786","cell cycle DNA replication",27,66,1e-24
"GO:0006996","organelle organization",125,4044,1e-24
"GO:0051726","regulation of cell cycle",73,1220,1e-24
"GO:0033260","nuclear DNA replication",26,61,1e-24
"GO:0051301","cell division",54,603,1e-24
"GO:0048285","organelle fission",49,471,1e-24
"GO:0010564","regulation of cell cycle process",57,784,1e-24
"GO:0007346","regulation of mitotic cell cycle",53,664,1e-24
"GO:0006139","nucleobase-containing compound metabolic process",145,6126,1e-24
"GO:0140014","mitotic nuclear division",38,281,1e-24
"GO:0007059","chromosome segregation",40,337,1e-24
"GO:0046483","heterocycle metabolic process",146,6301,1e-24
"GO:0006725","cellular aromatic compound metabolic process",146,6346,1e-24
"GO:0000819","sister chromatid segregation",33,199,1e-24
"GO:0000082","G1/S transition of mitotic cell cycle",37,281,1e-24
"GO:0090304","nucleic acid metabolic process",136,5602,1e-24
"GO:0006310","DNA recombination",37,295,1e-24
"GO:1901360","organic cyclic compound metabolic process",147,6580,1e-24
"GO:0045786","negative regulation of cell cycle",49,631,1e-24
"GO:0044843","cell cycle G1/S phase transition",37,304,1e-24
"GO:0033554","cellular response to stress",83,2093,1e-24
"GO:0098813","nuclear chromosome segregation",35,275,1e-24
"GO:0010948","negative regulation of cell cycle process",38,353,1e-24
"GO:0000075","cell cycle checkpoint",32,219,1e-24
"GO:0034641","cellular nitrogen compound metabolic process",147,6898,2.00592105263158e-24
"GO:0000723","telomere maintenance",28,161,3.51807692307692e-24
"GO:0006302","double-strand break repair",33,262,4.954625e-24
"GO:0071840","cellular component organization or biogenesis",144,6685,5.42870731707317e-24
"GO:0022616","DNA strand elongation",16,26,5.44464285714286e-24
"GO:1901990","regulation of mitotic cell cycle phase transition",40,441,6.098e-24
"GO:0007093","mitotic cell cycle checkpoint",28,166,7.6225e-24
"GO:1901987","regulation of cell cycle phase transition",41,479,1.28735555555556e-23
"GO:0032200","telomere organization",28,172,2.05476086956522e-23
"GO:0045930","negative regulation of mitotic cell cycle",35,335,7.78468085106383e-23
"GO:0000070","mitotic sister chromatid segregation",27,164,1.07985416666667e-22
"GO:0071103","DNA conformation change",35,346,2.17785714285714e-22
"GO:0016043","cellular component organization",139,6494,3.47586e-22
"GO:0051321","meiotic cell cycle",30,254,5.32080392156863e-21
"GO:0044260","cellular macromolecule metabolic process",156,8343,1.17269230769231e-20
"GO:1901988","negative regulation of cell cycle phase transition",30,264,1.61079245283019e-20
"GO:1901991","negative regulation of mitotic cell cycle phase transition",29,245,2.5972962962963e-20
"GO:0032201","telomere maintenance via semi-conservative replication",14,27,1.55221818181818e-19
"GO:0000724","double-strand break repair via homologous recombination",23,138,2.12341071428571e-19
"GO:0000725","recombinational repair",23,140,2.94201754385965e-19
"GO:0031570","DNA integrity checkpoint",24,161,4.25808620689655e-19
"GO:0006271","DNA strand elongation involved in DNA replication",12,19,3.82416949152542e-18
"GO:0072331","signal transduction by p53 class mediator",28,268,3.86206666666667e-18
"GO:0033044","regulation of chromosome organization",31,360,1.04965573770492e-17
"GO:1902850","microtubule cytoskeleton organization involved in mitosis",22,146,1.42614516129032e-17
"GO:0000077","DNA damage checkpoint",22,151,2.95220634920635e-17
"GO:1903046","meiotic cell cycle process",24,193,3.096640625e-17
"GO:0006807","nitrogen compound metabolic process",170,10491,3.70570769230769e-17
"GO:0032392","DNA geometric change",20,116,3.74195454545455e-17
"GO:0044839","cell cycle G2/M phase transition",27,272,6.3710447761194e-17
"GO:0006270","DNA replication initiation",14,39,8.51926470588235e-17
"GO:0051983","regulation of chromosome segregation",19,107,1.54659420289855e-16
"GO:0009059","macromolecule biosynthetic process",112,5063,1.61161428571429e-16
"GO:0006297","nucleotide-excision repair, DNA gap filling",12,24,1.63185915492958e-16
"GO:0034645","cellular macromolecule biosynthetic process",110,4917,1.82093055555556e-16
"GO:0000226","microtubule cytoskeleton organization",37,611,2.84016438356164e-16
"GO:0071824","protein-DNA complex subunit organization",26,273,7.00445945945946e-16
"GO:0007051","spindle organization",23,203,1.2196e-15
"GO:0000086","G2/M transition of mitotic cell cycle",25,253,1.24367105263158e-15
"GO:0007052","mitotic spindle organization",19,120,1.30671428571429e-15
"GO:0044774","mitotic DNA integrity checkpoint",18,108,3.51807692307692e-15
"GO:0071897","DNA biosynthetic process",22,195,6.56113924050633e-15
"GO:0045787","positive regulation of cell cycle",29,394,8.765875e-15
"GO:1901576","organic substance biosynthetic process",122,6168,9.78691358024691e-15
"GO:0043170","macromolecule metabolic process",166,10514,1.26421951219512e-14
"GO:0044773","mitotic DNA damage checkpoint",17,101,2.05715662650602e-14
"GO:0044249","cellular biosynthetic process",120,6085,3.12159523809524e-14
"GO:0009058","biosynthetic process",122,6267,3.58705882352941e-14
"GO:0044238","primary metabolic process",169,10984,4.96348837209302e-14
"GO:1902749","regulation of cell cycle G2/M phase transition",22,216,5.25689655172414e-14
"GO:0034654","nucleobase-containing compound biosynthetic process",95,4149,5.54363636363636e-14
"GO:0032508","DNA duplex unwinding",17,108,6.16651685393258e-14
"GO:2001251","negative regulation of chromosome organization",19,148,6.29684782608696e-14
"GO:0090068","positive regulation of cell cycle process",25,301,6.29684782608696e-14
"GO:0044237","cellular metabolic process",171,11250,6.29684782608696e-14
"GO:0060249","anatomical structure homeostasis",30,469,9.50763440860215e-14
"GO:0006298","mismatch repair",12,38,1.07039361702128e-13
"GO:0051304","chromosome separation",16,94,1.09122105263158e-13
"GO:0007062","sister chromatid cohesion",14,63,1.17513541666667e-13
"GO:0140013","meiotic nuclear division",20,177,1.25731958762887e-13
"GO:0018130","heterocycle biosynthetic process",95,4211,1.33782653061224e-13
"GO:0019438","aromatic compound biosynthetic process",95,4222,1.57069696969697e-13
"GO:1901362","organic cyclic compound biosynthetic process",97,4375,1.64646e-13
"GO:0065004","protein-DNA complex assembly",22,234,2.38486138613861e-13
"GO:0007017","microtubule-based process",38,810,2.92943137254902e-13
"GO:0006950","response to stress",93,4149,4.73631067961165e-13
"GO:0061982","meiosis I cell cycle process",17,124,5.86346153846154e-13
"GO:0044085","cellular component biogenesis",80,3268,1.01633333333333e-12
"GO:0010389","regulation of G2/M transition of mitotic cell cycle",20,199,1.12180188679245e-12
"GO:0010965","regulation of mitotic sister chromatid separation",13,61,1.88069158878505e-12
"GO:1901796","regulation of signal transduction by p53 class mediator",19,180,2.00443518518519e-12
"GO:0051306","mitotic sister chromatid separation",13,64,3.63642201834862e-12
"GO:0042769","DNA damage response, detection of DNA damage",11,38,4.15772727272727e-12
"GO:0051052","regulation of DNA metabolic process",25,365,4.35571428571429e-12
"GO:0007127","meiosis I",16,119,4.35571428571429e-12
"GO:0007088","regulation of mitotic nuclear division",18,165,5.08166666666667e-12
"GO:0051783","regulation of nuclear division",19,190,5.08166666666667e-12
"GO:1905818","regulation of chromosome separation",13,66,5.30260869565217e-12
"GO:2000134","negative regulation of G1/S transition of mitotic cell cycle",16,121,5.51974137931034e-12
"GO:0090305","nucleic acid phosphodiester bond hydrolysis",23,308,6.71813559322034e-12
"GO:0033045","regulation of sister chromatid segregation",14,84,6.71813559322034e-12
"GO:0006301","postreplication repair",12,53,7.43033613445378e-12
"GO:1902807","negative regulation of cell cycle G1/S phase transition",16,127,1.143375e-11
"GO:0071704","organic substance metabolic process",173,11997,1.31031404958678e-11
"GO:0033047","regulation of mitotic sister chromatid segregation",13,72,1.62446721311475e-11
"GO:0006323","DNA packaging",20,231,1.6360487804878e-11
"GO:0072401","signal transduction involved in DNA integrity checkpoint",13,73,1.902576e-11
"GO:0072422","signal transduction involved in DNA damage checkpoint",13,73,1.902576e-11
"GO:0006289","nucleotide-excision repair",15,111,2.10526190476191e-11
"GO:0007091","metaphase/anaphase transition of mitotic cell cycle",12,58,2.20872440944882e-11
"GO:0042770","signal transduction in response to DNA damage",16,133,2.2217519379845e-11
"GO:0072395","signal transduction involved in cell cycle checkpoint",13,74,2.2217519379845e-11
"GO:0006275","regulation of DNA replication",15,112,2.34538461538462e-11
"GO:0044784","metaphase/anaphase transition of cell cycle",12,60,3.25847328244275e-11
"GO:0006325","chromatin organization",35,812,3.46477272727273e-11
"GO:1902969","mitotic DNA replication",8,16,4.12646616541353e-11
"GO:0010639","negative regulation of organelle organization",25,414,5.91597014925373e-11
"GO:0044271","cellular nitrogen compound biosynthetic process",98,4917,8.58237037037037e-11
"GO:0006296","nucleotide-excision repair, DNA incision, 5'-to lesion",10,37,9.41602941176471e-11
"GO:0022607","cellular component assembly",72,3023,1.22405109489051e-10
"GO:0090329","regulation of DNA-dependent DNA replication",11,52,1.41402898550725e-10
"GO:0033683","nucleotide-excision repair, DNA incision",10,39,1.64514388489209e-10
"GO:0000731","DNA synthesis involved in DNA repair",11,53,1.76406428571429e-10
"GO:0007050","cell cycle arrest",19,235,1.85967375886525e-10
"GO:0000727","double-strand break repair via break-induced replication",7,12,2.3619014084507e-10
"GO:0030071","regulation of mitotic metaphase/anaphase transition",11,56,3.19825174825175e-10
"GO:0019985","translesion synthesis",10,42,3.59951388888889e-10
"GO:0051225","spindle assembly",15,136,3.78496551724138e-10
"GO:2000113","negative regulation of cellular macromolecule biosynthetic process",48,1580,4.38554794520548e-10
"GO:1902099","regulation of metaphase/anaphase transition of cell cycle",11,58,4.77054421768707e-10
"GO:0010558","negative regulation of macromolecule biosynthetic process",49,1647,5.15033783783784e-10
"GO:0009411","response to UV",15,140,5.52503355704698e-10
"GO:0033046","negative regulation of sister chromatid segregation",10,44,5.69146666666667e-10
"GO:0051784","negative regulation of nuclear division",11,60,6.86529801324503e-10
"GO:0051985","negative regulation of chromosome segregation",10,45,7.02072368421053e-10
"GO:0006267","pre-replicative complex assembly involved in nuclear cell cycle DNA replication",6,8,7.47496774193548e-10
"GO:0036388","pre-replicative complex assembly",6,8,7.47496774193548e-10
"GO:1902299","pre-replicative complex assembly involved in cell cycle DNA replication",6,8,7.47496774193548e-10
"GO:0070987","error-free translesion synthesis",8,22,8.01339743589744e-10
"GO:0051054","positive regulation of DNA metabolic process",17,199,9.12757961783439e-10
"GO:0000079","regulation of cyclin-dependent protein serine/threonine kinase activity",13,100,9.64873417721519e-10
"GO:0019219","regulation of nucleobase-containing compound metabolic process",84,4043,1.0546855345912e-9
"GO:0031571","mitotic G1 DNA damage checkpoint",11,63,1.12431875e-9
"GO:0044783","G1 DNA damage checkpoint",11,64,1.33629012345679e-9
"GO:0044819","mitotic G1/S transition checkpoint",11,64,1.33629012345679e-9
"GO:0009314","response to radiation",24,445,1.44032515337423e-9
"GO:1904029","regulation of cyclin-dependent protein kinase activity",13,104,1.54309146341463e-9
"GO:2000045","regulation of G1/S transition of mitotic cell cycle",16,179,1.6815696969697e-9
"GO:0031327","negative regulation of cellular biosynthetic process",49,1710,1.74490963855422e-9
"GO:0030330","DNA damage response, signal transduction by p53 class mediator",13,107,2.19089820359281e-9
"GO:0090307","mitotic spindle assembly",11,68,2.54083333333333e-9
"GO:0008152","metabolic process",173,12553,2.70621301775148e-9
"GO:0031497","chromatin assembly",16,186,2.85286549707602e-9
"GO:0045839","negative regulation of mitotic nuclear division",10,52,2.85286549707602e-9
"GO:0045934","negative regulation of nucleobase-containing compound metabolic process",46,1562,2.96188571428571e-9
"GO:0009890","negative regulation of biosynthetic process",49,1739,2.96188571428571e-9
"GO:0033043","regulation of organelle organization",42,1335,2.96188571428571e-9
"GO:0071478","cellular response to radiation",16,187,2.96188571428571e-9
"GO:2000816","negative regulation of mitotic sister chromatid separation",9,39,4.15772727272727e-9
"GO:0045132","meiotic chromosome segregation",12,93,5.25105555555556e-9
"GO:0006284","base-excision repair",9,40,5.25105555555556e-9
"GO:1905819","negative regulation of chromosome separation",9,40,5.25105555555556e-9
"GO:0006283","transcription-coupled nucleotide-excision repair",11,73,5.25105555555556e-9
"GO:0072431","signal transduction involved in mitotic G1 DNA damage checkpoint",10,57,7.20368131868132e-9
"GO:1902400","intracellular signal transduction involved in G1 DNA damage checkpoint",10,57,7.20368131868132e-9
"GO:1902806","regulation of cell cycle G1/S phase transition",16,200,7.8307650273224e-9
"GO:0033048","negative regulation of mitotic sister chromatid segregation",9,42,8.28532608695652e-9
"GO:0022414","reproductive process",44,1501,9.06459459459459e-9
"GO:0000003","reproduction",44,1504,9.50763440860215e-9
"GO:0072413","signal transduction involved in mitotic cell cycle checkpoint",10,59,9.84068783068783e-9
"GO:1902402","signal transduction involved in mitotic DNA damage checkpoint",10,59,9.84068783068783e-9
"GO:1902403","signal transduction involved in mitotic DNA integrity checkpoint",10,59,9.84068783068783e-9
"GO:0045005","DNA-dependent DNA replication maintenance of fidelity",9,44,1.23564736842105e-8
"GO:0006333","chromatin assembly or disassembly",16,211,1.59633507853403e-8
"GO:0042276","error-prone translesion synthesis",7,21,2.38203125e-8
"GO:1902750","negative regulation of cell cycle G2/M phase transition",12,107,2.52766839378238e-8
"GO:0034502","protein localization to chromosome",11,85,2.64454081632653e-8
"GO:0051169","nuclear transport",20,357,2.64454081632653e-8
"GO:0034622","cellular protein-containing complex assembly",36,1104,2.64454081632653e-8
"GO:0009628","response to abiotic stimulus",38,1231,4.02406091370558e-8
"GO:0031572","G2 DNA damage checkpoint",8,36,5.20934673366834e-8
"GO:0045841","negative regulation of mitotic metaphase/anaphase transition",8,36,5.20934673366834e-8
"GO:0070192","chromosome organization involved in meiotic cell cycle",10,70,5.33575e-8
"GO:0051171","regulation of nitrogen compound metabolic process",103,5942,6.3710447761194e-8
"GO:1902100","negative regulation of metaphase/anaphase transition of cell cycle",8,37,6.64138613861386e-8
"GO:0010212","response to ionizing radiation",13,145,7.96044334975369e-8
"GO:0006977","DNA damage response, signal transduction by p53 class mediator resulting in cell cycle arrest",9,56,1.10600980392157e-7
"GO:0031323","regulation of cellular metabolic process",107,6348,1.17498048780488e-7
"GO:0051253","negative regulation of RNA metabolic process",41,1459,1.21367961165049e-7
"GO:0043933","protein-containing complex subunit organization",49,1957,1.34038164251208e-7
"GO:0006303","double-strand break repair via nonhomologous end joining",11,100,1.42188942307692e-7
"GO:0006268","DNA unwinding involved in DNA replication",6,16,1.45190476190476e-7
"GO:0034401","chromatin organization involved in regulation of transcription",13,153,1.45190476190476e-7
"GO:0008283","cell population proliferation",50,2039,1.72584905660377e-7
"GO:0080090","regulation of primary metabolic process",104,6135,1.72584905660377e-7
"GO:0031860","telomeric 3' overhang formation",4,4,1.86089201877934e-7
"GO:0034644","cellular response to UV",10,81,2.12720930232558e-7
"GO:0071158","positive regulation of cell cycle arrest",10,81,2.12720930232558e-7
"GO:0065003","protein-containing complex assembly",44,1675,2.25851851851852e-7
"GO:0071156","regulation of cell cycle arrest",11,106,2.52912442396313e-7
"GO:0048523","negative regulation of cellular process",91,5095,2.65738532110092e-7
"GO:0031324","negative regulation of cellular metabolic process",60,2752,3.049e-7
"GO:0000726","non-recombinational repair",11,108,3.049e-7
"GO:0007143","female meiotic nuclear division",7,31,4.13891402714932e-7
"GO:0007010","cytoskeleton organization",39,1414,4.66963963963964e-7
"GO:0097549","chromatin organization involved in negative regulation of transcription",12,140,4.78542600896861e-7
"GO:1903507","negative regulation of nucleic acid-templated transcription",38,1358,4.90017857142857e-7
"GO:1902679","negative regulation of RNA biosynthetic process",38,1360,5.12663716814159e-7
"GO:0044818","mitotic G2/M transition checkpoint",7,32,5.12663716814159e-7
"GO:0051302","regulation of cell division",13,171,5.23837004405286e-7
"GO:0051338","regulation of transferase activity",32,1023,5.56773913043478e-7
"GO:0000910","cytokinesis",13,172,5.56773913043478e-7
"GO:0032465","regulation of cytokinesis",10,90,5.56773913043478e-7
"GO:0045892","negative regulation of transcription, DNA-templated",37,1315,6.46757575757576e-7
"GO:0006913","nucleocytoplasmic transport",18,354,6.57112068965517e-7
"GO:0010556","regulation of macromolecule biosynthetic process",77,4079,6.80463519313305e-7
"GO:0010605","negative regulation of macromolecule metabolic process",70,3548,6.9058547008547e-7
"GO:0007569","cell aging",11,118,7.13595744680851e-7
"GO:0007094","mitotic spindle assembly checkpoint",7,34,7.6225e-7
"GO:0008156","negative regulation of DNA replication",7,34,7.6225e-7
"GO:0031577","spindle checkpoint",7,34,7.6225e-7
"GO:0071173","spindle assembly checkpoint",7,34,7.6225e-7
"GO:0071174","mitotic spindle checkpoint",7,34,7.6225e-7
"GO:0010972","negative regulation of G2/M transition of mitotic cell cycle",10,95,8.98253112033195e-7
"GO:0006312","mitotic recombination",6,22,0.00000112132644628099
"GO:0007131","reciprocal meiotic recombination",8,55,0.00000150567901234568
"GO:0010332","response to gamma radiation",8,56,0.00000161783673469388
"GO:0035825","homologous recombination",8,56,0.00000161783673469388
"GO:0051172","negative regulation of nitrogen compound metabolic process",55,2549,0.00000185914634146341
"GO:0002200","somatic diversification of immune receptors",9,79,0.00000197506072874494
"GO:2000112","regulation of cellular macromolecule biosynthetic process",74,3957,0.00000209004032258065
"GO:0006220","pyrimidine nucleotide metabolic process",8,59,0.00000244899598393574
"GO:0000018","regulation of DNA recombination",10,107,0.00000268312
"GO:0050000","chromosome localization",9,82,0.00000278281746031746
"GO:0051303","establishment of chromosome localization",9,82,0.00000278281746031746
"GO:0070317","negative regulation of G0 to G1 transition",7,41,0.0000028584375
"GO:0032774","RNA biosynthetic process",70,3683,0.0000028584375
"GO:0045931","positive regulation of mitotic cell cycle",12,167,0.0000028584375
"GO:0090399","replicative senescence",5,14,0.0000028584375
"GO:0051128","regulation of cellular component organization",53,2448,0.00000295445736434109
"GO:0031145","anaphase-promoting complex-dependent catabolic process",9,83,0.00000295445736434109
"GO:0031326","regulation of cellular biosynthetic process",77,4237,0.00000317849420849421
"GO:0009889","regulation of biosynthetic process",78,4320,0.00000328353846153846
"GO:0045143","homologous chromosome segregation",8,62,0.00000350459770114942
"GO:0051129","negative regulation of cellular component organization",25,741,0.00000430583969465649
"GO:0034728","nucleosome organization",12,174,0.00000440539923954373
"GO:0051310","metaphase plate congression",8,64,0.00000450420454545455
"GO:0060255","regulation of macromolecule metabolic process",109,6964,0.0000046022641509434
"GO:0070316","regulation of G0 to G1 transition",7,45,0.00000527270676691729
"GO:0097659","nucleic acid-templated transcription",69,3670,0.00000536715355805243
"GO:0016310","phosphorylation",52,2431,0.00000557466417910448
"GO:0016070","RNA metabolic process",87,5106,0.00000566728624535316
"GO:0031573","intra-S DNA damage checkpoint",5,16,0.00000587214814814815
"GO:0045023","G0 to G1 transition",7,46,0.00000607549815498155
"GO:0071214","cellular response to abiotic stimulus",16,331,0.00000636604395604396
"GO:0104004","cellular response to environmental stimulus",16,331,0.00000636604395604396
"GO:0016032","viral process",28,921,0.00000645408759124088
"GO:2001252","positive regulation of chromosome organization",12,182,0.00000687410909090909
"GO:0002562","somatic diversification of immune receptors via germline recombination within a single locus",8,68,0.00000690960431654676
"GO:0016444","somatic cell DNA recombination",8,68,0.00000690960431654676
"GO:0071479","cellular response to ionizing radiation",8,68,0.00000690960431654676
"GO:0051252","regulation of RNA metabolic process",70,3777,0.00000699412186379928
"GO:0006611","protein export from nucleus",12,184,0.00000751360714285714
"GO:0009892","negative regulation of metabolic process",70,3790,0.0000080009219858156
"GO:0006978","DNA damage response, signal transduction by p53 class mediator resulting in transcription of p21 class mediator",5,17,0.0000080009219858156
"GO:0045814","negative regulation of gene expression, epigenetic",10,123,0.00000872681978798586
"GO:0009157","deoxyribonucleoside monophosphate biosynthetic process",4,8,0.00000912552816901408
"GO:0070507","regulation of microtubule cytoskeleton organization",12,190,0.000010377298245614
"GO:0009123","nucleoside monophosphate metabolic process",8,72,0.0000104476223776224
"GO:2001020","regulation of response to DNA damage stimulus",13,226,0.0000104809375
"GO:0045736","negative regulation of cyclin-dependent protein serine/threonine kinase activity",6,32,0.0000104809375
"GO:0042772","DNA damage response, signal transduction resulting in transcription",5,18,0.0000105137931034483
"GO:0007098","centrosome cycle",10,126,0.0000105137931034483
"GO:0048519","negative regulation of biological process",97,6040,0.0000115254295532646
"GO:0071482","cellular response to light stimulus",10,128,0.0000124873720136519
"GO:1904030","negative regulation of cyclin-dependent protein kinase activity",6,33,0.0000124873720136519
"GO:2000104","negative regulation of DNA-dependent DNA replication",5,19,0.0000144698305084746
"GO:0009262","deoxyribonucleotide metabolic process",6,34,0.0000144698305084746
"GO:0072528","pyrimidine-containing compound biosynthetic process",7,53,0.0000151943521594684
"GO:0006342","chromatin silencing",8,76,0.0000151943521594684
"GO:0048478","replication fork protection",4,9,0.0000151943521594684
"GO:0085020","protein K6-linked ubiquitination",4,9,0.0000151943521594684
"GO:1900262","regulation of DNA-directed DNA polymerase activity",4,9,0.0000151943521594684
"GO:1900264","positive regulation of DNA-directed DNA polymerase activity",4,9,0.0000151943521594684
"GO:0006282","regulation of DNA repair",10,132,0.0000160473684210526
"GO:0072527","pyrimidine-containing compound metabolic process",9,103,0.0000160473684210526
"GO:0010629","negative regulation of gene expression",55,2743,0.0000160473684210526
"GO:0009416","response to light stimulus",15,317,0.0000169944262295082
"GO:0034504","protein localization to nucleus",14,277,0.0000179352941176471
"GO:0016233","telomere capping",7,55,0.0000187478964401295
"GO:0036297","interstrand cross-link repair",7,55,0.0000187478964401295
"GO:0044403","symbiotic process",28,980,0.0000187478964401295
"GO:0051168","nuclear export",12,204,0.0000206545161290323
"GO:0031023","microtubule organizing center organization",10,137,0.0000215684887459807
"GO:0051170","import into nucleus",11,171,0.0000224766025641026
"GO:0006351","transcription, DNA-templated",66,3617,0.0000272753993610224
"GO:0046605","regulation of centrosome cycle",7,59,0.0000291305732484076
"GO:2000278","regulation of DNA biosynthetic process",9,113,0.0000338777777777778
"GO:0006338","chromatin remodeling",12,217,0.000037511356466877
"GO:0009162","deoxyribonucleoside monophosphate metabolic process",4,11,0.000037511356466877
"GO:0007095","mitotic G2 DNA damage checkpoint",5,24,0.000046022641509434
"GO:0006606","protein import into nucleus",10,150,0.0000468341692789969
"GO:0045935","positive regulation of nucleobase-containing compound metabolic process",41,1855,0.000047640625
"GO:0032886","regulation of microtubule-based process",12,223,0.0000493919003115265
"GO:0070925","organelle assembly",26,919,0.000052861919504644
"GO:0051347","positive regulation of transferase activity",22,696,0.000052861919504644
"GO:0051255","spindle midzone assembly",4,12,0.0000545808641975309
"GO:0000729","DNA double-strand break processing",5,25,0.0000553510769230769
"GO:0009124","nucleoside monophosphate biosynthetic process",6,43,0.0000561165644171779
"GO:0006796","phosphate-containing compound metabolic process",61,3315,0.0000587422018348624
"GO:0016445","somatic diversification of immunoglobulins",7,66,0.000060422256097561
"GO:0007064","mitotic sister chromatid cohesion",5,26,0.0000667258358662614
"GO:0007568","aging",14,315,0.0000711433333333333
"GO:0006793","phosphorus metabolic process",61,3342,0.0000746129909365559
