goId,goName,countDE,countAll,pv_fdr
"GO:2000106","regulation of leukocyte apoptotic process",3,86,0.149507575987842
"GO:0008584","male gonad development",4,141,0.149671867881549
"GO:0032506","cytokinetic process",2,39,0.150253980288097
"GO:0033146","regulation of intracellular estrogen receptor signaling pathway",2,39,0.150253980288097
"GO:0046546","development of primary male sexual characteristics",4,142,0.15245
"GO:0000380","alternative mRNA splicing, via spliceosome",3,87,0.152980461422088
"GO:0010660","regulation of muscle cell apoptotic process",3,87,0.152980461422088
"GO:0030010","establishment of cell polarity",4,143,0.155215532879819
"GO:0006730","one-carbon metabolic process",2,40,0.156126262245667
"GO:0042307","positive regulation of protein import into nucleus",2,40,0.156126262245667
"GO:1901068","guanosine-containing compound metabolic process",2,40,0.156126262245667
"GO:2000279","negative regulation of DNA biosynthetic process",2,40,0.156126262245667
"GO:0032436","positive regulation of proteasomal ubiquitin-dependent protein catabolic process",3,88,0.15635015048909
"GO:1903312","negative regulation of mRNA metabolic process",3,88,0.15635015048909
"GO:0050871","positive regulation of B cell activation",4,144,0.157562233082707
"GO:0002700","regulation of production of molecular mediator of immune response",4,145,0.160605101427498
"GO:0030890","positive regulation of B cell proliferation",2,41,0.161409780701754
"GO:1902042","negative regulation of extrinsic apoptotic signaling pathway via death domain receptors",2,41,0.161409780701754
"GO:0030097","hemopoiesis",15,925,0.161409780701754
"GO:0002069","columnar/cuboidal epithelial cell maturation",1,7,0.161409780701754
"GO:0002176","male germ cell proliferation",1,7,0.161409780701754
"GO:0006578","amino-acid betaine biosynthetic process",1,7,0.161409780701754
"GO:0007000","nucleolus organization",1,7,0.161409780701754
"GO:0007406","negative regulation of neuroblast proliferation",1,7,0.161409780701754
"GO:0009188","ribonucleoside diphosphate biosynthetic process",1,7,0.161409780701754
"GO:0010994","free ubiquitin chain polymerization",1,7,0.161409780701754
"GO:0021796","cerebral cortex regionalization",1,7,0.161409780701754
"GO:0030174","regulation of DNA-dependent DNA replication initiation",1,7,0.161409780701754
"GO:0035234","ectopic germ cell programmed cell death",1,7,0.161409780701754
"GO:0035405","histone-threonine phosphorylation",1,7,0.161409780701754
"GO:0036089","cleavage furrow formation",1,7,0.161409780701754
"GO:0036093","germ cell proliferation",1,7,0.161409780701754
"GO:0036123","histone H3-K9 dimethylation",1,7,0.161409780701754
"GO:0042138","meiotic DNA double-strand break formation",1,7,0.161409780701754
"GO:0043570","maintenance of DNA repeat elements",1,7,0.161409780701754
"GO:0043634","polyadenylation-dependent ncRNA catabolic process",1,7,0.161409780701754
"GO:0044528","regulation of mitochondrial mRNA stability",1,7,0.161409780701754
"GO:0044837","actomyosin contractile ring organization",1,7,0.161409780701754
"GO:0051096","positive regulation of helicase activity",1,7,0.161409780701754
"GO:0060717","chorion development",1,7,0.161409780701754
"GO:0061087","positive regulation of histone H3-K27 methylation",1,7,0.161409780701754
"GO:0061511","centriole elongation",1,7,0.161409780701754
"GO:0071475","cellular hyperosmotic salinity response",1,7,0.161409780701754
"GO:0090166","Golgi disassembly",1,7,0.161409780701754
"GO:0090232","positive regulation of spindle checkpoint",1,7,0.161409780701754
"GO:0090240","positive regulation of histone H4 acetylation",1,7,0.161409780701754
"GO:0090267","positive regulation of mitotic cell cycle spindle assembly checkpoint",1,7,0.161409780701754
"GO:0097168","mesenchymal stem cell proliferation",1,7,0.161409780701754
"GO:1901525","negative regulation of mitophagy",1,7,0.161409780701754
"GO:1990144","intrinsic apoptotic signaling pathway in response to hypoxia",1,7,0.161409780701754
"GO:2000210","positive regulation of anoikis",1,7,0.161409780701754
"GO:2000618","regulation of histone H4-K16 acetylation",1,7,0.161409780701754
"GO:2000973","regulation of pro-B cell differentiation",1,7,0.161409780701754
"GO:0031396","regulation of protein ubiquitination",5,208,0.161752788321168
"GO:0061013","regulation of mRNA catabolic process",5,208,0.161752788321168
"GO:0010657","muscle cell apoptotic process",3,91,0.164036644784829
"GO:0071229","cellular response to acid chemical",5,209,0.164117091836735
"GO:1904591","positive regulation of protein import",2,42,0.164308455935907
"GO:0007283","spermatogenesis",10,555,0.166097270742358
"GO:0000956","nuclear-transcribed mRNA catabolic process",5,210,0.166375614545455
"GO:0051606","detection of stimulus",12,704,0.166852979651163
"GO:0009259","ribonucleotide metabolic process",8,413,0.168436768336964
"GO:0001101","response to acid chemical",7,346,0.173492082728592
"GO:0045638","negative regulation of myeloid cell differentiation",3,94,0.17578147826087
"GO:0097194","execution phase of apoptosis",3,94,0.17578147826087
"GO:0042327","positive regulation of phosphorylation",17,1098,0.175808740043447
"GO:0034660","ncRNA metabolic process",9,489,0.175968335745297
"GO:0045910","negative regulation of DNA recombination",2,44,0.176661351156069
"GO:0090503","RNA phosphodiester bond hydrolysis, exonucleolytic",2,44,0.176661351156069
"GO:0044092","negative regulation of molecular function",18,1180,0.17815767920511
"GO:0006511","ubiquitin-dependent protein catabolic process",11,639,0.17815767920511
"GO:0000733","DNA strand renaturation",1,8,0.17815767920511
"GO:0009120","deoxyribonucleoside metabolic process",1,8,0.17815767920511
"GO:0010825","positive regulation of centrosome duplication",1,8,0.17815767920511
"GO:0019856","pyrimidine nucleobase biosynthetic process",1,8,0.17815767920511
"GO:0033034","positive regulation of myeloid cell apoptotic process",1,8,0.17815767920511
"GO:0034475","U4 snRNA 3'-end processing",1,8,0.17815767920511
"GO:0043045","DNA methylation involved in embryo development",1,8,0.17815767920511
"GO:0043633","polyadenylation-dependent RNA catabolic process",1,8,0.17815767920511
"GO:0045008","depyrimidination",1,8,0.17815767920511
"GO:0045656","negative regulation of monocyte differentiation",1,8,0.17815767920511
"GO:0071493","cellular response to UV-B",1,8,0.17815767920511
"GO:0072396","response to cell cycle checkpoint signaling",1,8,0.17815767920511
"GO:0072402","response to DNA integrity checkpoint signaling",1,8,0.17815767920511
"GO:0072423","response to DNA damage checkpoint signaling",1,8,0.17815767920511
"GO:0098532","histone H3-K27 trimethylation",1,8,0.17815767920511
"GO:1900193","regulation of oocyte maturation",1,8,0.17815767920511
"GO:1901538","changes to DNA methylation involved in embryo development",1,8,0.17815767920511
"GO:1901724","positive regulation of cell proliferation involved in kidney development",1,8,0.17815767920511
"GO:1903251","multi-ciliated epithelial cell differentiation",1,8,0.17815767920511
"GO:1905446","regulation of mitochondrial ATP synthesis coupled electron transport",1,8,0.17815767920511
"GO:1905456","regulation of lymphoid progenitor cell differentiation",1,8,0.17815767920511
"GO:1990414","replication-born double-strand break repair via sister chromatid exchange",1,8,0.17815767920511
"GO:2000617","positive regulation of histone H3-K9 acetylation",1,8,0.17815767920511
"GO:0031057","negative regulation of histone modification",2,45,0.180109248759745
"GO:0034198","cellular response to amino acid starvation",2,45,0.180109248759745
"GO:0065008","regulation of biological quality",53,4156,0.182119447592068
"GO:0061351","neural precursor cell proliferation",4,155,0.182918421797594
"GO:0042100","B cell proliferation",3,97,0.184231949152542
"GO:0070301","cellular response to hydrogen peroxide",3,97,0.184231949152542
"GO:1901216","positive regulation of neuron death",3,97,0.184231949152542
"GO:0060322","head development",13,797,0.184812004234298
"GO:0019941","modification-dependent protein catabolic process",11,645,0.184853688293371
"GO:0048538","thymus development",2,46,0.185969661733615
"GO:0021700","developmental maturation",6,286,0.18646138028169
"GO:0016064","immunoglobulin mediated immune response",5,220,0.187510281491907
"GO:0009056","catabolic process",36,2690,0.188000225035162
"GO:0048232","male gamete generation",10,574,0.190182178496135
"GO:0014075","response to amine",2,47,0.192232598314607
"GO:0007163","establishment or maintenance of cell polarity",5,222,0.192525628070175
"GO:0030099","myeloid cell differentiation",8,430,0.193593638869745
"GO:0019724","B cell mediated immunity",5,223,0.193593638869745
"GO:0000459","exonucleolytic trimming involved in rRNA processing",1,9,0.193593638869745
"GO:0000467","exonucleolytic trimming to generate mature 3'-end of 5.8S rRNA from tricistronic rRNA transcript (SSU-rRNA, 5.8S rRNA, LSU-rRNA)",1,9,0.193593638869745
"GO:0010637","negative regulation of mitochondrial fusion",1,9,0.193593638869745
"GO:0022417","protein maturation by protein folding",1,9,0.193593638869745
"GO:0030223","neutrophil differentiation",1,9,0.193593638869745
"GO:0030952","establishment or maintenance of cytoskeleton polarity",1,9,0.193593638869745
"GO:0031441","negative regulation of mRNA 3'-end processing",1,9,0.193593638869745
"GO:0035520","monoubiquitinated protein deubiquitination",1,9,0.193593638869745
"GO:0045003","double-strand break repair via synthesis-dependent strand annealing",1,9,0.193593638869745
"GO:0048387","negative regulation of retinoic acid receptor signaling pathway",1,9,0.193593638869745
"GO:0048539","bone marrow development",1,9,0.193593638869745
"GO:0051660","establishment of centrosome localization",1,9,0.193593638869745
"GO:0072718","response to cisplatin",1,9,0.193593638869745
"GO:0090129","positive regulation of synapse maturation",1,9,0.193593638869745
"GO:0090435","protein localization to nuclear envelope",1,9,0.193593638869745
"GO:0099527","postsynapse to nucleus signaling pathway",1,9,0.193593638869745
"GO:1901857","positive regulation of cellular respiration",1,9,0.193593638869745
"GO:1901978","positive regulation of cell cycle checkpoint",1,9,0.193593638869745
"GO:1902746","regulation of lens fiber cell differentiation",1,9,0.193593638869745
"GO:1903147","negative regulation of autophagy of mitochondrion",1,9,0.193593638869745
"GO:1903867","extraembryonic membrane development",1,9,0.193593638869745
"GO:1904667","negative regulation of ubiquitin protein ligase activity",1,9,0.193593638869745
"GO:1904776","regulation of protein localization to cell cortex",1,9,0.193593638869745
"GO:2000674","regulation of type B pancreatic cell apoptotic process",1,9,0.193593638869745
"GO:0045732","positive regulation of protein catabolic process",5,224,0.194468243801653
"GO:1990928","response to amino acid starvation",2,48,0.195257708189952
"GO:0002702","positive regulation of production of molecular mediator of immune response",3,101,0.196780027510316
"GO:2000058","regulation of ubiquitin-dependent protein catabolic process",4,161,0.197462041237113
"GO:0001933","negative regulation of protein phosphorylation",8,435,0.199923097527473
"GO:0009267","cellular response to starvation",4,162,0.200581091283459
"GO:0044703","multi-organism reproductive process",16,1050,0.202806598079561
"GO:0021549","cerebellum development",3,103,0.204888623287671
"GO:0035335","peptidyl-tyrosine dephosphorylation",3,103,0.204888623287671
"GO:0046661","male sex differentiation",4,164,0.206756402188782
"GO:0098727","maintenance of cell number",4,164,0.206756402188782
"GO:0031647","regulation of protein stability",6,297,0.207323663704716
"GO:0002762","negative regulation of myeloid leukocyte differentiation",2,50,0.207477686006826
"GO:0031648","protein destabilization",2,50,0.207477686006826
"GO:1902106","negative regulation of leukocyte differentiation",3,104,0.208235861837693
"GO:2000060","positive regulation of ubiquitin-dependent protein catabolic process",3,104,0.208235861837693
"GO:0019882","antigen processing and presentation",5,230,0.208235861837693
"GO:0009725","response to hormone",15,977,0.208235861837693
"GO:0006188","IMP biosynthetic process",1,10,0.208235861837693
"GO:0006228","UTP biosynthetic process",1,10,0.208235861837693
"GO:0006285","base-excision repair, AP site formation",1,10,0.208235861837693
"GO:0009133","nucleoside diphosphate biosynthetic process",1,10,0.208235861837693
"GO:0010603","regulation of cytoplasmic mRNA processing body assembly",1,10,0.208235861837693
"GO:0010992","ubiquitin recycling",1,10,0.208235861837693
"GO:0031125","rRNA 3'-end processing",1,10,0.208235861837693
"GO:0031848","protection from non-homologous end joining at telomere",1,10,0.208235861837693
"GO:0032070","regulation of deoxyribonuclease activity",1,10,0.208235861837693
"GO:0033314","mitotic DNA replication checkpoint",1,10,0.208235861837693
"GO:0034427","nuclear-transcribed mRNA catabolic process, exonucleolytic, 3'-5'",1,10,0.208235861837693
"GO:0045654","positive regulation of megakaryocyte differentiation",1,10,0.208235861837693
"GO:0045793","positive regulation of cell size",1,10,0.208235861837693
"GO:0045876","positive regulation of sister chromatid cohesion",1,10,0.208235861837693
"GO:0060768","regulation of epithelial cell proliferation involved in prostate gland development",1,10,0.208235861837693
"GO:0070314","G1 to G0 transition",1,10,0.208235861837693
"GO:0072203","cell proliferation involved in metanephros development",1,10,0.208235861837693
"GO:0097050","type B pancreatic cell apoptotic process",1,10,0.208235861837693
"GO:1903431","positive regulation of cell maturation",1,10,0.208235861837693
"GO:1903862","positive regulation of oxidative phosphorylation",1,10,0.208235861837693
"GO:1904672","regulation of somatic stem cell population maintenance",1,10,0.208235861837693
"GO:2000109","regulation of macrophage apoptotic process",1,10,0.208235861837693
"GO:0000302","response to reactive oxygen species",5,231,0.208569571332887
"GO:0051259","protein complex oligomerization",5,231,0.208569571332887
"GO:0002824","positive regulation of adaptive immune response based on somatic recombination of immune receptors built from immunoglobulin superfamily domains",3,105,0.208943177257525
"GO:0046907","intracellular transport",25,1796,0.208943177257525
"GO:0006984","ER-nucleus signaling pathway",2,51,0.209626377585057
"GO:0031113","regulation of microtubule polymerization",2,51,0.209626377585057
"GO:0045646","regulation of erythrocyte differentiation",2,51,0.209626377585057
"GO:0048255","mRNA stabilization",2,51,0.209626377585057
"GO:0045936","negative regulation of phosphate metabolic process",10,592,0.209974466666667
"GO:0010563","negative regulation of phosphorus metabolic process",10,593,0.211440639147803
"GO:0034614","cellular response to reactive oxygen species",4,167,0.211440639147803
"GO:0002708","positive regulation of lymphocyte mediated immunity",3,106,0.21227369261477
"GO:0097305","response to alcohol",5,233,0.212720458776596
"GO:0043086","negative regulation of catalytic activity",13,826,0.213794664451827
"GO:0071695","anatomical structure maturation",5,234,0.215312848605578
"GO:0071887","leukocyte apoptotic process",3,108,0.220713609820836
"GO:0072698","protein localization to microtubule cytoskeleton",2,53,0.221335550488599
"GO:1901800","positive regulation of proteasomal protein catabolic process",3,109,0.221335550488599
"GO:0006183","GTP biosynthetic process",1,11,0.221335550488599
"GO:0006348","chromatin silencing at telomere",1,11,0.221335550488599
"GO:0006449","regulation of translational termination",1,11,0.221335550488599
"GO:0016078","tRNA catabolic process",1,11,0.221335550488599
"GO:0018401","peptidyl-proline hydroxylation to 4-hydroxy-L-proline",1,11,0.221335550488599
"GO:0031442","positive regulation of mRNA 3'-end processing",1,11,0.221335550488599
"GO:0031915","positive regulation of synaptic plasticity",1,11,0.221335550488599
"GO:0033197","response to vitamin E",1,11,0.221335550488599
"GO:0034770","histone H4-K20 methylation",1,11,0.221335550488599
"GO:0043471","regulation of cellular carbohydrate catabolic process",1,11,0.221335550488599
"GO:0045141","meiotic telomere clustering",1,11,0.221335550488599
"GO:0045899","positive regulation of RNA polymerase II transcription preinitiation complex assembly",1,11,0.221335550488599
"GO:0046051","UTP metabolic process",1,11,0.221335550488599
"GO:0048102","autophagic cell death",1,11,0.221335550488599
"GO:0051574","positive regulation of histone H3-K9 methylation",1,11,0.221335550488599
"GO:0060281","regulation of oocyte development",1,11,0.221335550488599
"GO:0060767","epithelial cell proliferation involved in prostate gland development",1,11,0.221335550488599
"GO:0061085","regulation of histone H3-K27 methylation",1,11,0.221335550488599
"GO:0072697","protein localization to cell cortex",1,11,0.221335550488599
"GO:0090309","positive regulation of DNA methylation-dependent heterochromatin assembly",1,11,0.221335550488599
"GO:1902018","negative regulation of cilium assembly",1,11,0.221335550488599
"GO:1902065","response to L-glutamate",1,11,0.221335550488599
"GO:1903800","positive regulation of production of miRNAs involved in gene silencing by miRNA",1,11,0.221335550488599
"GO:1905168","positive regulation of double-strand break repair via homologous recombination",1,11,0.221335550488599
"GO:1905879","regulation of oogenesis",1,11,0.221335550488599
"GO:1990440","positive regulation of transcription from RNA polymerase II promoter in response to endoplasmic reticulum stress",1,11,0.221335550488599
"GO:0002244","hematopoietic progenitor cell differentiation",4,172,0.223891087239583
"GO:1903320","regulation of protein modification by small protein conjugation or removal",5,239,0.225245370611183
"GO:0002821","positive regulation of adaptive immune response",3,110,0.225245370611183
"GO:0046649","lymphocyte activation",12,759,0.225911286549708
"GO:0022037","metencephalon development",3,112,0.234040448051948
"GO:1901565","organonitrogen compound catabolic process",19,1329,0.235000363288719
"GO:0070228","regulation of lymphocyte apoptotic process",2,56,0.235000363288719
"GO:0071398","cellular response to fatty acid",2,56,0.235000363288719
"GO:0048024","regulation of mRNA splicing, via spliceosome",3,113,0.235000363288719
"GO:0010562","positive regulation of phosphorus metabolic process",17,1168,0.235000363288719
"GO:0045937","positive regulation of phosphate metabolic process",17,1168,0.235000363288719
"GO:0006563","L-serine metabolic process",1,12,0.235000363288719
"GO:0006983","ER overload response",1,12,0.235000363288719
"GO:0009071","serine family amino acid catabolic process",1,12,0.235000363288719
"GO:0009151","purine deoxyribonucleotide metabolic process",1,12,0.235000363288719
"GO:0014029","neural crest formation",1,12,0.235000363288719
"GO:0034086","maintenance of sister chromatid cohesion",1,12,0.235000363288719
"GO:0034088","maintenance of mitotic sister chromatid cohesion",1,12,0.235000363288719
"GO:0034392","negative regulation of smooth muscle cell apoptotic process",1,12,0.235000363288719
"GO:0034397","telomere localization",1,12,0.235000363288719
"GO:0042538","hyperosmotic salinity response",1,12,0.235000363288719
"GO:0043696","dedifferentiation",1,12,0.235000363288719
"GO:0043697","cell dedifferentiation",1,12,0.235000363288719
"GO:0051974","negative regulation of telomerase activity",1,12,0.235000363288719
"GO:0055015","ventricular cardiac muscle cell development",1,12,0.235000363288719
"GO:0070243","regulation of thymocyte apoptotic process",1,12,0.235000363288719
"GO:0070493","thrombin-activated receptor signaling pathway",1,12,0.235000363288719
"GO:0071472","cellular response to salt stress",1,12,0.235000363288719
"GO:0071481","cellular response to X-ray",1,12,0.235000363288719
"GO:0071888","macrophage apoptotic process",1,12,0.235000363288719
"GO:0072711","cellular response to hydroxyurea",1,12,0.235000363288719
"GO:0090220","chromosome localization to nuclear envelope involved in homologous chromosome segregation",1,12,0.235000363288719
"GO:0090677","reversible differentiation",1,12,0.235000363288719
"GO:2000105","positive regulation of DNA-dependent DNA replication",1,12,0.235000363288719
"GO:0097237","cellular response to toxic substance",5,245,0.23799678343949
"GO:0002521","leukocyte differentiation",9,538,0.239303829516539
"GO:0045860","positive regulation of protein kinase activity",9,538,0.239303829516539
"GO:0030520","intracellular estrogen receptor signaling pathway",2,57,0.239683128172589
"GO:0044380","protein localization to cytoskeleton",2,57,0.239683128172589
"GO:0051568","histone H3-K4 methylation",2,57,0.239683128172589
"GO:0070534","protein K63-linked ubiquitination",2,57,0.239683128172589
"GO:0006096","glycolytic process",3,115,0.241968485424588
"GO:0021987","cerebral cortex development",3,115,0.241968485424588
"GO:0006886","intracellular protein transport",17,1177,0.24469238758708
"GO:0043489","RNA stabilization",2,58,0.245613888888889
"GO:0046128","purine ribonucleoside metabolic process",2,58,0.245613888888889
"GO:1902373","negative regulation of mRNA catabolic process",2,58,0.245613888888889
"GO:0006757","ATP generation from ADP",3,116,0.245613888888889
"GO:0051261","protein depolymerization",3,116,0.245613888888889
"GO:0006352","DNA-templated transcription, initiation",5,249,0.247567401869159
"GO:0001682","tRNA 5'-leader removal",1,13,0.247567401869159
"GO:0002638","negative regulation of immunoglobulin production",1,13,0.247567401869159
"GO:0002903","negative regulation of B cell apoptotic process",1,13,0.247567401869159
"GO:0009437","carnitine metabolic process",1,13,0.247567401869159
"GO:0010623","programmed cell death involved in cell development",1,13,0.247567401869159
"GO:0010635","regulation of mitochondrial fusion",1,13,0.247567401869159
"GO:0021978","telencephalon regionalization",1,13,0.247567401869159
"GO:0031115","negative regulation of microtubule polymerization",1,13,0.247567401869159
"GO:0031453","positive regulation of heterochromatin assembly",1,13,0.247567401869159
"GO:0034244","negative regulation of transcription elongation from RNA polymerase II promoter",1,13,0.247567401869159
"GO:0043247","telomere maintenance in response to DNA damage",1,13,0.247567401869159
"GO:0046040","IMP metabolic process",1,13,0.247567401869159
"GO:0046415","urate metabolic process",1,13,0.247567401869159
"GO:0048096","chromatin-mediated maintenance of transcription",1,13,0.247567401869159
"GO:0071027","nuclear RNA surveillance",1,13,0.247567401869159
"GO:0071028","nuclear mRNA surveillance",1,13,0.247567401869159
"GO:0071287","cellular response to manganese ion",1,13,0.247567401869159
"GO:0072710","response to hydroxyurea",1,13,0.247567401869159
"GO:0098789","pre-mRNA cleavage required for polyadenylation",1,13,0.247567401869159
"GO:1905064","negative regulation of vascular smooth muscle cell differentiation",1,13,0.247567401869159
"GO:1902531","regulation of intracellular signal transduction",25,1850,0.247830921544209
"GO:0043525","positive regulation of neuron apoptotic process",2,59,0.248470746268657
"GO:0051289","protein homotetramerization",2,59,0.248470746268657
"GO:0009260","ribonucleotide biosynthetic process",4,183,0.251708309509012
"GO:0010823","negative regulation of mitochondrion organization",2,60,0.254840378646803
"GO:0043388","positive regulation of DNA binding",2,60,0.254840378646803
"GO:1900542","regulation of purine nucleotide metabolic process",3,119,0.254984919354839
"GO:0009150","purine ribonucleotide metabolic process",7,398,0.25529940483571
"GO:0030163","protein catabolic process",14,946,0.257445923172243
"GO:0042326","negative regulation of phosphorylation",8,475,0.259193318885449
"GO:0042278","purine nucleoside metabolic process",2,61,0.259406394640682
"GO:1902041","regulation of extrinsic apoptotic signaling pathway via death domain receptors",2,61,0.259406394640682
"GO:1903902","positive regulation of viral life cycle",2,61,0.259406394640682
"GO:0015671","oxygen transport",1,14,0.259406394640682
"GO:0032042","mitochondrial DNA metabolic process",1,14,0.259406394640682
"GO:0043558","regulation of translational initiation in response to stress",1,14,0.259406394640682
"GO:0045605","negative regulation of epidermal cell differentiation",1,14,0.259406394640682
"GO:0045799","positive regulation of chromatin assembly or disassembly",1,14,0.259406394640682
"GO:0045898","regulation of RNA polymerase II transcription preinitiation complex assembly",1,14,0.259406394640682
"GO:0070234","positive regulation of T cell apoptotic process",1,14,0.259406394640682
"GO:0070914","UV-damage excision repair",1,14,0.259406394640682
"GO:0071285","cellular response to lithium ion",1,14,0.259406394640682
"GO:0072216","positive regulation of metanephros development",1,14,0.259406394640682
"GO:0090128","regulation of synapse maturation",1,14,0.259406394640682
"GO:0090231","regulation of spindle checkpoint",1,14,0.259406394640682
"GO:0090239","regulation of histone H4 acetylation",1,14,0.259406394640682
"GO:0090266","regulation of mitotic cell cycle spindle assembly checkpoint",1,14,0.259406394640682
"GO:0090308","regulation of DNA methylation-dependent heterochromatin assembly",1,14,0.259406394640682
"GO:0098787","mRNA cleavage involved in mRNA processing",1,14,0.259406394640682
"GO:1900119","positive regulation of execution phase of apoptosis",1,14,0.259406394640682
"GO:1900239","regulation of phenotypic switching",1,14,0.259406394640682
"GO:1901070","guanosine-containing compound biosynthetic process",1,14,0.259406394640682
"GO:1902570","protein localization to nucleolus",1,14,0.259406394640682
"GO:1903504","regulation of mitotic spindle checkpoint",1,14,0.259406394640682
"GO:1903799","negative regulation of production of miRNAs involved in gene silencing by miRNA",1,14,0.259406394640682
"GO:1990403","embryonic brain development",1,14,0.259406394640682
